[
  {
    "id": 1,
    "prompt": "Which declaration allows the variable `count` to be reassigned?",
    "options": ["let count = 0;", "let mut count = 0;", "const count: i32 = 0;", "let count = 0.clone();"],
    "correct_answers": [1],
    "explanation": "Bindings are immutable by default. The `mut` keyword permits reassignment."
  },
  {
    "id": 2,
    "prompt": "Which of these standard scalar types implement `Copy`? Select all that apply.",
    "options": ["i32", "bool", "char", "String"],
    "correct_answers": [0, 1, 2],
    "explanation": "Integer types, booleans, and characters are Copy. String owns heap data and is moved unless explicitly cloned."
  },
  {
    "id": 3,
    "prompt": "What happens after `let second = first;` when `first` is a `String`?",
    "options": ["Both variables independently own the same allocation", "Ownership moves to `second` and `first` can no longer be used", "The string is automatically cloned", "The allocation is immediately freed"],
    "correct_answers": [1],
    "explanation": "Assigning a non-Copy value moves ownership. Rust prevents use of the previous binding."
  },
  {
    "id": 4,
    "prompt": "Which statements about shared references (`&T`) are true? Select all that apply.",
    "options": ["Multiple shared references may coexist", "A shared reference always owns its value", "The referenced value cannot be mutated through a shared reference", "A shared reference must have a `'static` lifetime"],
    "correct_answers": [0, 2],
    "explanation": "Shared references permit multiple readers, but they do not grant mutation or ownership."
  },
  {
    "id": 5,
    "prompt": "While an `&mut T` borrow is active, what other access to that value is allowed?",
    "options": ["Any number of shared borrows", "No other borrow through the original owner", "One additional mutable borrow", "Only raw-pointer writes"],
    "correct_answers": [1],
    "explanation": "A mutable borrow is exclusive for its active lifetime."
  },
  {
    "id": 6,
    "prompt": "Which properties describe a slice such as `&[i32]`? Select all that apply.",
    "options": ["It borrows a contiguous sequence", "It always owns a heap allocation", "It stores a pointer and a length", "Its length must be known at compile time"],
    "correct_answers": [0, 2],
    "explanation": "A slice is a dynamically sized view represented by a data pointer and a length."
  },
  {
    "id": 7,
    "prompt": "What does a lifetime annotation on a function primarily express?",
    "options": ["How many seconds a value lives", "Relationships between the lifetimes of references", "When the garbage collector should run", "The order in which functions execute"],
    "correct_answers": [1],
    "explanation": "Lifetime parameters connect input and output reference validity; they do not extend lifetimes."
  },
  {
    "id": 8,
    "prompt": "Which values normally have a `'static` lifetime? Select all that apply.",
    "options": ["String literals", "Items declared with `static`", "Every local String", "Every reference returned from a function"],
    "correct_answers": [0, 1],
    "explanation": "String literals are embedded in the binary, and static items exist for the program's duration."
  },
  {
    "id": 9,
    "prompt": "Why does Rust not support indexing a `String` with a single integer?",
    "options": ["Strings are always encrypted", "Strings contain no bytes", "UTF-8 characters can occupy different numbers of bytes", "String indexing requires unsafe code"],
    "correct_answers": [2],
    "explanation": "A byte index does not necessarily identify a complete Unicode scalar value."
  },
  {
    "id": 10,
    "prompt": "Which statements about Rust strings are true? Select all that apply.",
    "options": ["String and str data is valid UTF-8", "`len()` returns the number of bytes", "`chars().count()` can differ from `len()`", "Every visible grapheme is exactly one `char`"],
    "correct_answers": [0, 1, 2],
    "explanation": "Rust strings are UTF-8. Character count may differ from byte length, and grapheme clusters may contain multiple chars."
  },
  {
    "id": 11,
    "prompt": "Which type represents exactly four 32-bit integers?",
    "options": ["Vec<i32>", "[i32; 4]", "&[i32]", "(i32, 4)"],
    "correct_answers": [1],
    "explanation": "The array type `[T; N]` includes its fixed length in the type."
  },
  {
    "id": 12,
    "prompt": "What may happen when pushing beyond a Vec's current capacity?",
    "options": ["The program must panic", "The Vec allocates a larger buffer and moves its elements", "The oldest element is removed", "The Vec becomes an array"],
    "correct_answers": [1],
    "explanation": "A vector grows by allocating additional capacity and relocating its elements when necessary."
  },
  {
    "id": 13,
    "prompt": "Which parameter type is usually most flexible for a read-only function accepting arrays and vectors?",
    "options": ["&[T]", "&Vec<T>", "[T; 10]", "Vec<T>"],
    "correct_answers": [0],
    "explanation": "A slice accepts borrowed data from arrays, vectors, and other contiguous sequences."
  },
  {
    "id": 14,
    "prompt": "Which HashMap API is designed to insert a default only when a key is absent?",
    "options": ["drain", "entry(...).or_insert(...)", "capacity", "retain"],
    "correct_answers": [1],
    "explanation": "The entry API performs conditional insertion without a separate lookup."
  },
  {
    "id": 15,
    "prompt": "Which tasks suit a HashSet? Select all that apply.",
    "options": ["Tracking unique values", "Indexing values by numeric position", "Fast membership checks", "Storing duplicate values in insertion order"],
    "correct_answers": [0, 2],
    "explanation": "HashSet is designed for uniqueness and average constant-time membership checks."
  },
  {
    "id": 16,
    "prompt": "What does `Option<T>` represent?",
    "options": ["A value or an error message", "Either `Some(T)` or `None`", "A value that must be heap allocated", "A value shared across threads"],
    "correct_answers": [1],
    "explanation": "Option models the presence or absence of a value without null."
  },
  {
    "id": 17,
    "prompt": "What can the `?` operator do with a Result? Select all that apply.",
    "options": ["Extract the Ok value", "Convert every error into a panic", "Return early when the value is Err", "Ignore an error and continue"],
    "correct_answers": [0, 2],
    "explanation": "The operator unwraps success or propagates a compatible error to the caller."
  },
  {
    "id": 18,
    "prompt": "When is `panic!` generally most appropriate?",
    "options": ["For every invalid user input", "For unrecoverable states or violated internal invariants", "Instead of all Result values", "For normal control flow"],
    "correct_answers": [1],
    "explanation": "Expected failures should normally use Result; panics signal bugs or unrecoverable conditions."
  },
  {
    "id": 19,
    "prompt": "What can struct update syntax (`..other`) do with non-Copy fields?",
    "options": ["It always clones them", "It may move them from `other`", "It makes them public", "It converts them to references"],
    "correct_answers": [1],
    "explanation": "Fields not explicitly supplied are moved unless their types implement Copy."
  },
  {
    "id": 20,
    "prompt": "Which statements about enums are true? Select all that apply.",
    "options": ["Each variant may carry different data", "All variants exist simultaneously", "Pattern matching can destructure variant data", "Enums cannot have methods"],
    "correct_answers": [0, 2],
    "explanation": "An enum value is one variant at a time, and variants may contain different fields."
  },
  {
    "id": 21,
    "prompt": "What important property does `match` provide for enums?",
    "options": ["Automatic parallel execution", "Exhaustiveness checking", "Implicit heap allocation", "Dynamic typing"],
    "correct_answers": [1],
    "explanation": "The compiler verifies that every possible case is handled unless a catch-all pattern is present."
  },
  {
    "id": 22,
    "prompt": "When is `if let` especially useful?",
    "options": ["When every enum variant needs different logic", "When only one pattern matters and the rest can be ignored", "When declaring a generic type", "When spawning a thread"],
    "correct_answers": [1],
    "explanation": "if let is concise for a single interesting pattern."
  },
  {
    "id": 23,
    "prompt": "What does a generic function such as `fn first<T>(items: &[T])` abstract over?",
    "options": ["The element type", "The operating system", "The number of CPU cores", "The function's visibility"],
    "correct_answers": [0],
    "explanation": "The type parameter T allows the same implementation to work with many element types."
  },
  {
    "id": 24,
    "prompt": "What does a trait define?",
    "options": ["Only stored data fields", "Shared behavior or capabilities that types can implement", "A mandatory heap layout", "A package download source"],
    "correct_answers": [1],
    "explanation": "Traits declare methods, associated types, and constants that implementing types provide."
  },
  {
    "id": 25,
    "prompt": "Which syntax adds a Display requirement to a generic type T?",
    "options": ["T = Display", "T: Display", "T -> Display", "Display<T>"],
    "correct_answers": [1],
    "explanation": "A colon introduces trait bounds on a type parameter."
  },
  {
    "id": 26,
    "prompt": "Which statements describe trait objects such as `Box<dyn Draw>`? Select all that apply.",
    "options": ["They enable runtime dynamic dispatch", "They preserve the concrete type in the variable's static type", "They can store different concrete implementors behind one interface", "Every trait can automatically be used as a trait object"],
    "correct_answers": [0, 2],
    "explanation": "Trait objects erase the concrete type and dispatch object-safe methods through a vtable."
  },
  {
    "id": 27,